id,headline,date,section,snippet,source,type,url,word_count,locations,subjects
5c9a069f40d36ff0709cfd4d,b'Man City to Play Pre-Season Games in China',2019-03-26,Sports,"b'Manchester City will play pre-season matches in the Chinese cities of Nanjing and Shanghai in July as part of the Premier League Asia Trophy, the English champions said on Tuesday.'",Reuters,News,https://www.nytimes.com/reuters/2019/03/26/sports/soccer/26reuters-soccer-england-mci-china.html,264,[],[]
5c8ae37640d36ff070800b32,b'No Punishment for Russia Over Delay on Doping Data',2019-01-22,Sports,b'Russia missed the deadline for turning over data on its doping program by nearly three weeks. WADA decided that was not a problem.',The New York Times,News,https://www.nytimes.com/2019/01/22/sports/olympics/wada-russia.html,537,[],"['Doping (Sports)', 'Steroids']"
5c9410a440d36ff0709c9a1d,b'Players Go From Filling Out NCAA Brackets to Filling Them',2019-03-21,Sports,"b""Rapolas Ivanauskas looked forward to filling out his NCAA Tournament bracket every March, competing with his brother to see who had the better feel for college basketball's showcase.""",AP,News,https://www.nytimes.com/aponline/2019/03/21/sports/ncaabasketball/ap-bkc-ncaa-all-in-the-bracket.html,667,[],[]
5c8ae2bc40d36ff0707fe4d1,b'DeMarcus Cousins Eyes Return as Warriors Prepare for 5-All-Star Lineup',2019-01-09,Sports,"b'A year after sustaining a torn Achilles\xe2\x80\x99 tendon, Cousins is expected to join the reigning champions latest this month during the team\xe2\x80\x99s trip to Los Angeles.'",The New York Times,News,https://www.nytimes.com/2019/01/08/sports/demarcus-cousins-warriors-debut.html,577,[],"['Sports Injuries', 'Basketball']"
5ca2ab2340d36ff0709d10cd,b'Calipari Accepts Lifetime Deal From Kentucky',2019-04-02,Sports,"b""John Calipari has agreed to a long-term contract to remain men's basketball coach at Kentucky, the school announced Monday.""",Reuters,News,https://www.nytimes.com/reuters/2019/04/01/sports/01reuters-basketball-ncaa-ken-calipari-deal.html,371,[],[]
5c9d424140d36ff0709d0700,b'Bryce Harper\xe2\x80\x99s Phillies Debut Lifts a Suddenly Spoiled City',2019-03-28,Sports,"b'The Eagles, 76ers and Villanova men\xe2\x80\x99s basketball team have brought Philadelphia plenty of joy recently. Harper\xe2\x80\x99s arrival only brought more sports joy.'",The New York Times,News,https://www.nytimes.com/2019/03/28/sports/bryce-harper-phillies-opening-day.html,941,[],['Baseball']
5c8acc6440d36ff0707a633b,b'Another Season Comes and Goes While Pac-12 Struggles to Keep Up',2019-01-01,Sports,b'Underperforming media deals have left the conference falling behind its peers off the field. That might be the root of its problems on it.',The New York Times,News,https://www.nytimes.com/2019/01/01/sports/rose-bowl-pac12.html,1747,"['Los Angeles (Calif)', 'Western States (US)', 'California']","['College Athletics', 'Football (College)']"
5c9312de40d36ff0709c9494,b'NFL Notebook: Kraft Reportedly Wants to Block Alleged Video Release',2019-03-21,Sports,"b'New England Patriots owner Robert Kraft is seeking to suppress video evidence that authorities assert support the solicitation of prostitution charges filed against him, ESPN reported Wednesday.'",Reuters,News,https://www.nytimes.com/reuters/2019/03/21/sports/football/20reuters-football-nfl-notebook.html,683,[],[]
5c937c4840d36ff0709c967a,"b""Chelsea Women's Boss Hayes Hails Landmark Barclays Sponsorship Deal""",2019-03-21,Sports,"b'Chelsea Women\'s manager Emma Hayes has hailed Barclays\' sponsorship deal with the Women\'s Super League (WSL) as a ""watershed moment"", saying it gives the Football Association (FA) a perfect platform to sell the broadcasting rights to the competiti...'",Reuters,News,https://www.nytimes.com/reuters/2019/03/21/sports/soccer/21reuters-soccer-england-women.html,350,[],[]
5c8b4ce840d36ff0709bd38c,b'Top Bridge Player Suspended Under Antidoping Rules',2019-03-02,Sports,"b'Geir Helgemo, a Norwegian player, will not be allowed to compete for several months after a random drug test found the presence of banned substances, officials said.'",The New York Times,News,https://www.nytimes.com/2019/03/02/sports/bridge-player-suspended-doping.html,713,[],"['Bridge (Card Game)', 'Doping (Sports)', 'Tests (Drug Use)']"
5c93e0e140d36ff0709c992a,"b'Woman Accuses Cal Football Players, Staff of Sexual Harassment'",2019-03-21,Sports,b'The University of California at Berkeley released a statement saying that it has referred an allegation of sexual harassment made by a former intern to its own watchdog office.',Reuters,News,https://www.nytimes.com/reuters/2019/03/21/sports/21reuters-football-ncaa-cal-harassment-allegations.html,298,[],[]
5c8b4c8340d36ff0709bbda7,b'Zion Williamson\xe2\x80\x99s Shoe Splits Open During Game',2019-02-22,Sports,"b'Williamson, one of college basketball\xe2\x80\x99s biggest stars, injured his knee after one of his Nike shoes broke less than a minute into Duke\xe2\x80\x99s game against North Carolina.'",AP,Video,https://www.nytimes.com/video/sports/basketball/100000006374267/zion-williamsons-shoe-splits-open-during-game.html,0,[],"['Basketball (College)', 'Sneakers', 'Sports Injuries']"
5c8ae26340d36ff0707fd513,b'LeBron James Is Expected to Miss at Least Another Week',2019-01-05,Sports,"b'The Lakers said on Friday that James\xe2\x80\x99s strained groin would be re-evaluated in a week. James, known for his durability, has not played since getting hurt on Christmas Day.'",The New York Times,News,https://www.nytimes.com/2019/01/04/sports/lebron-james-lakers.html,557,[],"['Basketball', 'Sports Injuries']"
5ca3cb8340d36ff0709d139f,b'Another Football League Is on the Edge of Folding',2019-04-02,Sports,b'It seems the Alliance of American Football will become the latest N.F.L. alternative to fail.',The New York Times,News,https://www.nytimes.com/2019/04/02/sports/alliance-of-american-football-folding.html,898,[],['Football']
5c8b4ce840d36ff0709bd38c,b'Top Bridge Player Suspended Under Antidoping Rules',2019-03-02,Sports,"b'Geir Helgemo, a Norwegian player, will not be allowed to compete for several months after a random drug test found the presence of banned substances, officials said.'",The New York Times,News,https://www.nytimes.com/2019/03/02/sports/bridge-player-suspended-doping.html,713,[],"['Bridge (Card Game)', 'Doping (Sports)', 'Tests (Drug Use)']"
5c8b4ef240d36ff0709c6216,"b'In Rare Interview, James Dolan Insists He Won\xe2\x80\x99t Sell Knicks'",2019-03-13,Sports,"b'Dolan, who has been in the news over his argument with a fan over the weekend, said in a radio interview he would not part with the team, even for $6 billion.'",The New York Times,News,https://www.nytimes.com/2019/03/12/sports/james-dolan-knicks.html,814,[],['Basketball']
5ca2ab2340d36ff0709d10cd,b'Calipari Accepts Lifetime Deal From Kentucky',2019-04-02,Sports,"b""John Calipari has agreed to a long-term contract to remain men's basketball coach at Kentucky, the school announced Monday.""",Reuters,News,https://www.nytimes.com/reuters/2019/04/01/sports/01reuters-basketball-ncaa-ken-calipari-deal.html,371,[],[]
5c9d424140d36ff0709d0700,b'Bryce Harper\xe2\x80\x99s Phillies Debut Lifts a Suddenly Spoiled City',2019-03-28,Sports,"b'The Eagles, 76ers and Villanova men\xe2\x80\x99s basketball team have brought Philadelphia plenty of joy recently. Harper\xe2\x80\x99s arrival only brought more sports joy.'",The New York Times,News,https://www.nytimes.com/2019/03/28/sports/bryce-harper-phillies-opening-day.html,941,[],['Baseball']
5c937c4840d36ff0709c967a,"b""Chelsea Women's Boss Hayes Hails Landmark Barclays Sponsorship Deal""",2019-03-21,Sports,"b'Chelsea Women\'s manager Emma Hayes has hailed Barclays\' sponsorship deal with the Women\'s Super League (WSL) as a ""watershed moment"", saying it gives the Football Association (FA) a perfect platform to sell the broadcasting rights to the competiti...'",Reuters,News,https://www.nytimes.com/reuters/2019/03/21/sports/soccer/21reuters-soccer-england-women.html,350,[],[]
5ca2752740d36ff0709d106e,b'Calipari Accepts Lifetime Deal From Kentucky',2019-04-01,Sports,"b""John Calipari has agreed to a long-term contract to remain men's basketball coach at Kentucky, the school announced Monday.""",Reuters,News,https://www.nytimes.com/reuters/2019/04/01/sports/01reuters-basketball-ncaa-ken-calipari.html,371,[],[]
5c8ae48740d36ff070803feb,b'Another Pro Football League Is Born. Will It Outdo the (Short-Lived) Others?',2019-02-05,Sports,"b'The leagues have had strange rules, quirky names and colorful owners. But the series of failures have shown it is tough to make a play on the N.F.L.'",The New York Times,News,https://www.nytimes.com/2019/02/05/sports/football-new-league.html,1048,[],['Football']
5ca25a4040d36ff0709d102d,"b'UNC Places Hatchell, Staff on Leave During Review of Program'",2019-04-01,Sports,"b""North Carolina has placed Hall of Fame women's basketball coach Sylvia Hatchell and her three assistants on paid administrative leave amid player concerns and is reviewing the program.""",AP,News,https://www.nytimes.com/aponline/2019/04/01/sports/ncaabasketball/ap-bkw-north-carolina-program-review.html,421,[],[]
5c95312140d36ff0709ca010,b'Rugby-World Rugby Considers Rule Changes to Reduce Risk of Injury',2019-03-22,Sports,"b'World Rugby will explore potential rule changes to improve player safety and reduce the risk of injuries after delegates at a three-day player welfare symposium in Paris submitted proposals, the governing body said on Friday.'",Reuters,News,https://www.nytimes.com/reuters/2019/03/22/sports/rugby/22reuters-rugby-union-injuries.html,356,[],[]
5c9c2b5d40d36ff0709cfffe,b'Football-Ireland Fans Throw Tennis Balls to Disrupt Euro Qualifier',2019-03-26,Sports,"b""Irish fans disrupted a Euro 2020 qualifier against Georgia on Tuesday by throwing tennis balls onto the pitch in protest at chief executive John Delaney's continued role in the Football Association of Ireland (FAI).  """,Reuters,News,https://www.nytimes.com/reuters/2019/03/26/sports/soccer/26reuters-soccer-euro-irl-geo.html,392,[],[]
5ca2e2bb40d36ff0709d1129,b'Calipari Accepts Lifetime Deal From Kentucky',2019-04-02,Sports,"b""Field Level Media - John Calipari has agreed to a long-term contract to remain men's basketball coach at Kentucky, the school announced Monday.""",Reuters,News,https://www.nytimes.com/reuters/2019/04/02/sports/02reuters-basketball-ncaa-ucl-ken-calipari.html,393,[],[]
5c9c28fd40d36ff0709cff77,b'Weightlifting to Get All-Clear From IOC for Paris 2024',2019-03-26,Sports,"b""Weightlifting will be given the green light for inclusion in the Paris 2024 Olympics by the The International Olympic Committee (IOC) once an anti-doping agreement is in place, ending 18 months of uncertainty for the sport's future in the Games.""",Reuters,News,https://www.nytimes.com/reuters/2019/03/26/sports/olympics/26reuters-olympics-ioc-weightlifting.html,370,[],[]
5c9534a940d36ff0709ca03e,b'Louisville Pounds Robert Morris in Opener',2019-03-22,Sports,b'Two-time ACC Player of the Year Asia Durr scored 19 points as the host Louisville Cardinals routed the Robert Morris Colonials 69-34 in a first-round NCAA Tournament game on Friday afternoon.',Reuters,News,https://www.nytimes.com/reuters/2019/03/22/sports/basketball/22reuters-basketball-ncaa-unk-unk-recap.html,332,[],[]
5ca1319240d36ff0709d0dd1,b'Motor Racing-Rosberg Praises Ferrari but Criticises Vettel',2019-03-31,Sports,b'Retired Formula One world champion Nico Rosberg praised Ferrari for letting their drivers race each other in Bahrain on Sunday but criticised Sebastian Vettel for making the same mistakes as last season.',Reuters,News,https://www.nytimes.com/reuters/2019/03/31/sports/autoracing/31reuters-motor-f1-bahrain-rosberg.html,424,[],[]
5ca1480640d36ff0709d0def,b'Blue Jays RHP Luciano Is First Big Leaguer Born This Century',2019-03-31,Sports,"b'While Major League Baseball no longer has a single player who was active during the previous century, it now has its first player born in this one.'",AP,News,https://www.nytimes.com/aponline/2019/03/31/sports/baseball/ap-bba-blue-jays-luciano.html,409,[],[]
5c9c292140d36ff0709cffa9,b'Robert Kraft Waives Arraignment and Requests Jury Trial',2019-03-26,Sports,b'The New England Patriots owner continues his adversarial stance in the face of charges of soliciting prostitution.',The New York Times,News,https://www.nytimes.com/2019/03/26/sports/robert-kraft-arraignment-jury-trial.html,959,"['Florida', 'JUPITER (FLA)']",['Human Trafficking']
5c9c292140d36ff0709cffa9,b'Robert Kraft Waives Arraignment and Requests Jury Trial',2019-03-26,Sports,b'The New England Patriots owner continues his adversarial stance in the face of charges of soliciting prostitution.',The New York Times,News,https://www.nytimes.com/2019/03/26/sports/robert-kraft-arraignment-jury-trial.html,959,"['Florida', 'JUPITER (FLA)']",['Human Trafficking']
5c8ae34e40d36ff070800209,"b'For WADA, Another Crucial Discussion About Russia'",2019-01-13,Sports,b'A special committee will discuss whether Russia has done enough to comply with a demand for data about drug testing. It\xe2\x80\x99s complicated \xe2\x80\x94 or not.',The New York Times,News,https://www.nytimes.com/2019/01/13/sports/wada-russia-doping.html,1026,['Russia'],"['Steroids', 'Doping (Sports)', 'Olympic Games (2016)', 'Olympic Games (2018)']"
5ca41bfe40d36ff0709d144b,b'The Intricacy of Judging the F.E.I. World Cup Finals',2019-04-02,Sports,"b'Judges determine the winners in these equestrian events, of course, but also must ensure that the competition is fair and that the horses are safe.'",International New York Times,News,https://www.nytimes.com/2019/04/02/sports/judging-fei-world-cup-finals.html,1216,['Gothenburg (Sweden)'],"['Horsemanship and Equestrian Events', 'Dressage (Equestrian Sport)']"
5c8ae48940d36ff0708040be,b'The Helicopter Parent Descends on College Football',2019-02-06,Sports,"b'In the era of what some academics call \xe2\x80\x9cwe-parenting,\xe2\x80\x9d is it any wonder that parents also suit up in full football uniforms for signing day?'",The New York Times,News,https://www.nytimes.com/2019/02/06/sports/college-football-signing-day.html,1040,[],"['Football (College)', 'Colleges and Universities', 'Parenting', 'Social Media']"
5c998baa40d36ff0709cf66f,b'N.C.A.A. Appeals Latest Antitrust Ruling',2019-03-23,Sports,"b'The ruling this month cleared a path for some athletes to receive more compensation than they do now, but limited it to expenses \xe2\x80\x9crelated to education.\xe2\x80\x9d'",The New York Times,News,https://www.nytimes.com/2019/03/23/sports/ncaa-appeal-antitrust.html,419,[],"['Antitrust Laws and Competition Issues', 'Basketball']"
5ca2961840d36ff0709d10a7,"b""UNC Puts Women's Basketball Coaching Staff on Leave""",2019-04-01,Sports,"b'North Carolina has put its women\'s basketball coaching staff on paid administrative leave amid an investigation into ""issues raised by student-athletes and others,"" the school announced Monday in a news release.'",Reuters,News,https://www.nytimes.com/reuters/2019/04/01/sports/01reuters-basketball-ncaa-unk-hatchell-leave.html,466,[],[]
5c95311340d36ff0709ca00e,b'Athletics: U.N.-Backed Semenya Optimistic of CAS Success in Battle With IAAF',2019-03-22,Sports,"b'Double Olympic 800-metres champion Caster Semenya is ""optimistic"" of success in her appeal to the Court of Arbitration for Sport (CAS) over eligibility regulations in athletics for female classification.'",Reuters,News,https://www.nytimes.com/reuters/2019/03/22/sports/22reuters-athletics-semenya.html,415,[],[]
5ca280fd40d36ff0709d1080,b'Arsenal Climb to Third With Victory Over Newcastle',2019-04-01,Sports,b'ARSENAL 2 NEWCASTLE UNITED 0',Reuters,News,https://www.nytimes.com/reuters/2019/04/01/sports/soccer/01reuters-soccer-england-ars-new-report.html,473,[],[]
5c8ae41d40d36ff070802d8c,"b'Cooper Kupp Was Everywhere for the Rams, Until He Was Nowhere'",2019-01-30,Sports,b'A knee injury took away one of the Rams\xe2\x80\x99 most consistent options on offense. He joins a fraternity of players forced to sit out their first Super Bowl.',The New York Times,News,https://www.nytimes.com/2019/01/30/sports/cooper-kupp-rams-super-bowl-liii.html,1405,[],"['Football', 'Sports Injuries', 'Super Bowl']"
5c9f029540d36ff0709d0b0a,b'Australian Broadcaster Apologises After Coin-Toss Jibe at Amputee',2019-03-30,Sports,b'A prominent Australian Rules football broadcaster has apologised after drawing criticism for mocking a pre-game coin-toss by a plane crash victim ahead of a match between Sydney Swans and Adelaide Crows.',Reuters,News,https://www.nytimes.com/reuters/2019/03/30/sports/rugby/30reuters-australian-rules-amputee.html,463,[],[]
5c9f029540d36ff0709d0b0a,b'Australian Broadcaster Apologises After Coin-Toss Jibe at Amputee',2019-03-30,Sports,b'A prominent Australian Rules football broadcaster has apologised after drawing criticism for mocking a pre-game coin-toss by a plane crash victim ahead of a match between Sydney Swans and Adelaide Crows.',Reuters,News,https://www.nytimes.com/reuters/2019/03/30/sports/rugby/30reuters-australian-rules-amputee.html,463,[],[]
5c8b5d6140d36ff0709c6877,b'Exercise vs. Drugs to Treat High Blood Pressure and Reduce Fat',2019-03-13,Well,"b'Exercise can lower blood pressure and reduce visceral body fat at least as effectively as many common prescription drugs, two new reviews report.'",The New York Times,News,https://www.nytimes.com/2019/03/13/well/move/exercise-vs-drugs-to-treat-high-blood-pressure-and-reduce-fat.html,857,[],"['Exercise', 'Obesity', 'Weight', 'Drugs (Pharmaceuticals)', 'Blood Pressure', 'Sports Medicine']"
5c8ae44040d36ff070803439,"b'Behold the Knicks. Or Better Yet, Start Rooting for the Nets.'",2019-02-01,Sports,b'New York foolishly traded Kristaps Porzingis. But what else is new? Except for the fact that some fed-up Knicks fans might be turning their gaze toward Brooklyn.',The New York Times,News,https://www.nytimes.com/2019/02/01/sports/powell-knicks-porzingis-dallas-durant.html,1060,[],['Basketball']
5c8ae33840d36ff0707ffced,b'Politics Looms Over Empty Seats as Saudi Arabia Faces Qatar in Asian Cup',2019-01-17,Sports,"b'At a fraught Asian Cup, two countries embroiled in a geopolitical fight prepare to duel on the soccer field.'",The New York Times,News,https://www.nytimes.com/2019/01/17/sports/qatar-saudi-arabia-asian-cup.html,1652,"['Qatar', 'Saudi Arabia']","['Soccer', 'Politics and Government', 'International Relations']"
5c9989ba40d36ff0709cf514,"b'Team Sky Deal Should Motivate Chasing Pack, Says Rival Boss'",2019-03-23,Sports,"b""Not everyone has been celebrating Team Sky's impending takeover by Britain's richest man but it must not be regarded as a negative, according to one person tasked with trying to beat them on the road.""",Reuters,News,https://www.nytimes.com/reuters/2019/03/23/sports/cycling/23reuters-cycling-sky-plugge.html,594,[],[]
5c9989ca40d36ff0709cf590,b'Irish Chief Delaney Steps Aside Amid Governance Questions',2019-03-23,Sports,"b'Football Association of Ireland (FAI) chief executive John Delaney stepped aside from his role on Saturday, the FAI said, 10 days before he was due to appear before lawmakers over a 100,000 euro (85,606 pounds) loan provided to the governing body.'",Reuters,News,https://www.nytimes.com/reuters/2019/03/23/sports/soccer/23reuters-soccer-ireland-ceo.html,471,[],[]
5c937c1b40d36ff0709c9679,b'Growing Match-Fixing Probe in Tennis Snares More Players',2019-03-21,Sports,"b'French police have questioned another batch of tennis players in a growing investigation into a match-fixing syndicate suspected of paying out hundreds of thousands of dollars to fix low-level matches, judicial officials said Thursday.'",AP,News,https://www.nytimes.com/aponline/2019/03/21/sports/tennis/ap-ten-france-match-fixing.html,543,[],[]
5c9d09ca40d36ff0709d063f,b'Robert Kraft Asks Judge to Suppress Video Evidence',2019-03-28,Sports,"b'\xe2\x80\x9cFlorida resorted to the most drastic, invasive, indiscriminate spying conceivable by law enforcement,\xe2\x80\x9d lawyers for the Patriots owner contended.'",The New York Times,News,https://www.nytimes.com/2019/03/28/sports/robert-kraft-evidence-suppress-filing.html,642,[],['Football']
5c99f38f40d36ff0709cfcd1,b'Underarm or Underhanded? Kyrgios Serve Stokes Debate',2019-03-26,Sports,"b'Having annoyed Rafa Nadal with an underarm serve at Acapulco, Nick Kyrgios doubled down with the tactic to win two points against hapless Serb Dusan Lajovic at the Miami Open and fire up a timeworn debate between modern fans and purists.'",Reuters,News,https://www.nytimes.com/reuters/2019/03/26/sports/cricket/26reuters-tennis-miami-kyrgios.html,592,[],[]
5c8ae35640d36ff0708003a5,b'WADA to Consider Recommendations on Russia\xe2\x80\x99s Status Next Week',2019-01-18,Sports,b'The World Anti-Doping Agency\xe2\x80\x99s executive committee has scheduled a conference call for Tuesday to consider whether Russia can continue to be considered in compliance with the agency\xe2\x80\x99s standards.',The New York Times,News,https://www.nytimes.com/2019/01/18/sports/wada-russia.html,500,['Russia'],"['Steroids', 'Doping (Sports)', 'Athletics and Sports']"
5ca1c53040d36ff0709d0eb6,"b'Tatis, Jimenez in the Big Leagues From the Start'",2019-04-01,Sports,b'Opening day was particularly special for Fernando Tatis Jr. and Eloy Jimenez.',AP,News,https://www.nytimes.com/aponline/2019/04/01/sports/baseball/ap-bbo-this-week-in-baseball.html,591,[],[]
5c8b4cee40d36ff0709bd50c,b'Taking the Measure of Kyler Murray',2019-03-02,Sports,"b'At the N.F.L.\xe2\x80\x99s predraft combine, the biggest question has been whether Murray, one of the country\xe2\x80\x99s supreme athletes, has what it takes to play quarterback in the league.'",The New York Times,News,https://www.nytimes.com/2019/03/02/sports/kyler-murray-nfl-draft-combine.html,1002,[],"['Heisman Trophy', 'Draft and Recruitment (Sports)']"
5c9cd72440d36ff0709d0592,b'Russian Makes $16M Offer to Help Keep Boxing in Olympics',2019-03-28,Sports,"b""A Russian official has offered to pay the International Boxing Association's $16 million debt if the IOC keeps the sport in the 2020 Tokyo Olympics.""",AP,News,https://www.nytimes.com/aponline/2019/03/28/sports/olympics/ap-oly-box-aiba-russian-offer.html,562,[],[]
5c9989ba40d36ff0709cf514,"b'Team Sky Deal Should Motivate Chasing Pack, Says Rival Boss'",2019-03-23,Sports,"b""Not everyone has been celebrating Team Sky's impending takeover by Britain's richest man but it must not be regarded as a negative, according to one person tasked with trying to beat them on the road.""",Reuters,News,https://www.nytimes.com/reuters/2019/03/23/sports/cycling/23reuters-cycling-sky-plugge.html,594,[],[]
5c950e3e40d36ff0709c9f3d,"b'A Supposed Stickler for the Rules, Now at the Center of a U.S.C. Scandal'",2019-03-22,Sports,"b'At U.S.C., Donna Heinel was known as the athletic administrator who clashed with coaches over prospective recruits. Then she got indicted.'",The New York Times,News,https://www.nytimes.com/2019/03/22/sports/college-admissions-scandal-heinel.html,1973,[],"['College Admissions Scandal (2019)', 'ADMISSIONS STANDARDS', 'Colleges and Universities', 'College Athletics']"
5c8ae46540d36ff0708038aa,b'This Super Bowl Is Not Everyone\xe2\x80\x99s Bowl of Chips',2019-02-02,Sports,"b'St. Louis is angry the Rams left. New Orleans thinks the Saints got cheated. Los Angeles has the Rams, but hey, LeBron is back. Atlanta is the conflicted host.'",The New York Times,News,https://www.nytimes.com/2019/02/02/sports/super-bowl-fans-not-interested.html,1355,"['St Louis (Mo)', 'New Orleans (La)', 'Los Angeles (Calif)', 'Atlanta (Ga)']","['Football', 'Super Bowl']"
5c937c1b40d36ff0709c9679,b'Growing Match-Fixing Probe in Tennis Snares More Players',2019-03-21,Sports,"b'French police have questioned another batch of tennis players in a growing investigation into a match-fixing syndicate suspected of paying out hundreds of thousands of dollars to fix low-level matches, judicial officials said Thursday.'",AP,News,https://www.nytimes.com/aponline/2019/03/21/sports/tennis/ap-ten-france-match-fixing.html,543,[],[]
5c9d09ca40d36ff0709d063f,b'Robert Kraft Asks Judge to Suppress Video Evidence',2019-03-28,Sports,"b'\xe2\x80\x9cFlorida resorted to the most drastic, invasive, indiscriminate spying conceivable by law enforcement,\xe2\x80\x9d lawyers for the Patriots owner contended.'",The New York Times,News,https://www.nytimes.com/2019/03/28/sports/robert-kraft-evidence-suppress-filing.html,642,[],['Football']
5c8bc0c040d36ff0709c776c,b'Robert Kraft\xe2\x80\x99s Other Problem: Soccer',2019-03-15,Sports,"b'When Robert Kraft finishes dealing with solicitation charges in Florida, his soccer team could use some help.'",The New York Times,News,https://www.nytimes.com/2019/03/15/sports/soccer/robert-kraft-revolution.html,1221,[],['Soccer']
5c99f38f40d36ff0709cfcd1,b'Underarm or Underhanded? Kyrgios Serve Stokes Debate',2019-03-26,Sports,"b'Having annoyed Rafa Nadal with an underarm serve at Acapulco, Nick Kyrgios doubled down with the tactic to win two points against hapless Serb Dusan Lajovic at the Miami Open and fire up a timeworn debate between modern fans and purists.'",Reuters,News,https://www.nytimes.com/reuters/2019/03/26/sports/cricket/26reuters-tennis-miami-kyrgios.html,592,[],[]
5c8b4cd840d36ff0709bcff6,b'Taking Back \xe2\x80\x98Hysterical\xe2\x80\x99',2019-02-26,Sports,"b'Serena Williams\xe2\x80\x99s new all-female Nike ad, \xe2\x80\x9cDream Crazier,\xe2\x80\x9d hit on an issue almost as old as time: the \xe2\x80\x9chysterical\xe2\x80\x9d woman.'",The New York Times,News,https://www.nytimes.com/2019/02/26/sports/serena-williams-nike-ad.html,1035,['United States'],"['Women and Girls', ""Women's Rights""]"
